Key Base Phrase,EVIND_P,ECOR_P,GWSYA_P,UEF_P,AGIND_P,IEF_P,PEF_P,SAI_P
0,The natural environment in and along rivers and lakes ,Local businesses that provide community jobs and income ,Local groundwater supplies,Community residents and businesses,Farmers,Large industry such as mining and material processing,Power plants,Water supplies
20,"is no longer viable. Air quality is poor, heat is undesirable, and recreation is limited.",are no longer viable. Jobs and income have rapidly declined.,will soon be depleted.  Other sources of water or drastic reductions in demand will be needed.,are complaining that it is too expensive and not enjoyable to live here.,are finding it hard to remain in business because the cost for ultra-efficient farming is high.,are struggling due to the decrease in groundwater and fresh water supplies.,are struggling. The price of electricity and brownouts are increasing. ,are not sufficient to meet demand resulting in a large deficit.
40,"is declining. Air quality is worse, heat is increasing, with fewer recreation opportunities.",are declining. Jobs and income are declining. People are worried about their future.,are declining. It is uncertain how long groundwater will last.,are very efficient with their water use and understand that some sacrifices are needed to be sustainable.,are using very efficient farming practices even though the cost to do so is higher.,"are adopting new technologies and efficient processes, but the cost to do so is higher.",are aggressively lowering water use with slight increases in electric prices.,are not sufficient to meet demand resulting in a small deficit.
60,"is stable but stressed. Air quality is stable, heat is bearable, and recreation is stable.",are stable but stressed. Jobs and income are slowly growing. People are hopeful.,are stable. Drought or rapid demand increase may cause problems.,are efficiently using water.,are balancing efficient farming with the cost of agriculture.,are efficient; industry can be a key water supplier for the environment.,are shifting to lower water use technology and spreading costs over time.,are in balance with demand.
80,"is doing well. Air quality is improving, heat is stable, and recreation is increasing.",are doing well. Jobs and income are growing. People are content.,are slowly increasing. Chances of surviving a long-term drought are good.,are using more water than is really needed to maintain quality of life and economy.,are using more water than is needed to maintain a viable agricultural economy.,are growing rapidly and are impacting water availability.,are keeping electricity prices low while making efforts to reduce water use.,are larger than demand resulting in a small surplus.
100,"is thriving. Air quality is good, heat is declining, and recreation is excellent.",are thriving. Jobs and income are booming. People are excited.,in excellent shape. Chances of surviving a long-term drought are excellent.,are wasting water that could be used for other purposes.,are using water to maximize economic gains despite potential impacts on long-term water sustainability.,"are suffering water shortages, negatively impacting industry's bottom line.",are using water cooling to minimize costs despite impacts on long-term water sustainability.,are larger than demand resulting in a large surplus.
